{
  "AWS_REGION": "ap-south-1",
  "ROLE_ARN": "<GITHUB_OIDC_DEPLOYMENT_ROLE_ARN>",
  "ECS_CLUSTER": "<PILOT_ECS_CLUSTER>",
  "ECS_SERVICE": "<PILOT_ECS_SERVICE>",
  "ECR_REPOSITORY": "<API_ECR_REPOSITORY>",
  "CLAMD_ECR_REPOSITORY": "<CLAMD_ECR_REPOSITORY>",
  "API_IMAGE_DIGEST": "<sha256:64_HEX>",
  "CLAMD_IMAGE_DIGEST": "<sha256:64_HEX>",
  "RUNTIME_SECRET_ID": "<RUNTIME_SECRET_ID_OR_ARN>",
  "DOCUMENT_STORAGE_SECRET_ID": "<DOCUMENT_STORAGE_SECRET_ID_OR_ARN>",
  "API_BASE_URL": "https://<PILOT_API_HOST>",
  "TASK_CPU": "1024",
  "TASK_MEMORY": "3072",
  "ECS_EXECUTION_ROLE_ARN": "<ECS_EXECUTION_ROLE_ARN>",
  "ECS_TASK_ROLE_ARN": "<ECS_TASK_ROLE_ARN>",
  "QUALIFIED_ECR_IMAGE_URI_BY_DIGEST": "<ACCOUNT_ID>.dkr.ecr.ap-south-1.amazonaws.com/<API_ECR_REPOSITORY>@<sha256:64_HEX>",
  "QUALIFIED_CLAMD_IMAGE_URI_BY_DIGEST": "<ACCOUNT_ID>.dkr.ecr.ap-south-1.amazonaws.com/<CLAMD_ECR_REPOSITORY>@<sha256:64_HEX>",
  "DOCUMENT_STORAGE_S3_BUCKET": "<SYNTHETIC_PILOT_BUCKET>",
  "DOCUMENT_STORAGE_S3_KMS_KEY_ID": "<S3_KMS_KEY_ARN_OR_APPROVED_ID>",
  "APPLICATION_ENVELOPE_KMS_KEY_ID": "<APPLICATION_ENVELOPE_KMS_KEY_ARN_OR_APPROVED_ID>",
  "CLOUDWATCH_LOG_GROUP": "<PILOT_LOG_GROUP>",
  "DATABASE_URL_SECRET_REFERENCE": "<SECRETS_MANAGER_VALUE_REFERENCE>",
  "REDIS_URL_SECRET_REFERENCE": "<SECRETS_MANAGER_VALUE_REFERENCE>",
  "SUPABASE_URL_SECRET_REFERENCE": "<SECRETS_MANAGER_VALUE_REFERENCE>",
  "SUPABASE_KEY_SECRET_REFERENCE": "<SECRETS_MANAGER_VALUE_REFERENCE>",
  "DOCUMENT_STORAGE_ENCRYPTION_KEY_SECRET_REFERENCE": "<SECRETS_MANAGER_VALUE_REFERENCE>",
  "HANDSHAKE_PEPPER_SECRET_REFERENCE": "<SECRETS_MANAGER_VALUE_REFERENCE>",
  "MFA_ENCRYPTION_KEY_SECRET_REFERENCE": "<SECRETS_MANAGER_VALUE_REFERENCE>",
  "PII_ENCRYPTION_KEY_SECRET_REFERENCE": "<SECRETS_MANAGER_VALUE_REFERENCE>",
  "PATIENT_JWT_SECRET_REFERENCE": "<SECRETS_MANAGER_VALUE_REFERENCE>",
  "OTP_RATE_LIMIT_HMAC_SECRET_REFERENCE": "<SECRETS_MANAGER_VALUE_REFERENCE>",
  "PROVIDER_REGISTRATION_IDEMPOTENCY_HMAC_SECRET_REFERENCE": "<SECRETS_MANAGER_VALUE_REFERENCE>",
  "PROVIDER_CONTACT_ASSURANCE_HMAC_SECRET_REFERENCE": "<SECRETS_MANAGER_VALUE_REFERENCE>",
  "PATIENT_GRANT_REFERENCE_HMAC_SECRET_REFERENCE": "<SECRETS_MANAGER_VALUE_REFERENCE>",
  "OPERATIONS_AUTH_TOKEN_SECRET_REFERENCE": "<SECRETS_MANAGER_VALUE_REFERENCE>",
  "FINAL_API_HOST": "<PILOT_API_HOST>",
  "FINAL_DOCTOR_HTTPS_ORIGIN": "https://<PILOT_DOCTOR_HOST>",
  "FINAL_TRUSTED_PROXY_CIDRS": "<DIRECT_INGRESS_PROXY_CIDRS>",
  "FINAL_FORWARDED_PROXY_CIDRS": "<DIRECT_INGRESS_PROXY_CIDRS>"
}
